exp_id	description	target	mae	rmse	r2	prior	decision	notes
P25_019	hiding_power_pct: combo feats=['thickness_x_pigment', 'log_thickness']	hiding_power_pct	2.3603	3.8545	0.6195	0.50	REVERT	family=extratrees feats=2
P25_020	hiding_power_pct: combo feats=['thickness_x_pigment', 'matting_pigment_ratio']	hiding_power_pct	2.3631	3.8436	0.6216	0.45	REVERT	family=extratrees feats=2
P25_021	hiding_power_pct: combo feats=['thickness_x_pigment', 'pigment_paste_sq', 'matting_agent_sq']	hiding_power_pct	2.3015	3.6398	0.6607	0.45	REVERT	family=extratrees feats=3
P25_022	cupping_mm: combo feats=['cyc_x_matting', 'log_thickness']	cupping_mm	1.5231	2.1934	0.7104	0.55	REVERT	family=extratrees feats=2
P25_023	cupping_mm: combo feats=['cyc_x_matting', 'thickness_sq']	cupping_mm	1.5358	2.2081	0.7065	0.45	REVERT	family=extratrees feats=2
P25_024	cupping_mm: combo feats=['cyc_x_matting', 'crosslink_x_cyc']	cupping_mm	1.5514	2.1893	0.7115	0.45	REVERT	family=extratrees feats=2
P25_025	cupping_mm: combo feats=['cyc_x_matting', 'pvc_proxy']	cupping_mm	1.5194	2.1772	0.7147	0.40	KEEP	family=extratrees feats=2
P25_026	cupping_mm: combo feats=['cyc_x_matting', 'log_thickness', 'crosslink_x_cyc']	cupping_mm	1.5348	2.1867	0.7122	0.50	REVERT	family=extratrees feats=3
P25_027	scratch_hardness_N: retry xgboost on current features	scratch_hardness_N	2.1135	2.7252	-0.0612	0.35	REVERT	family=xgboost feats=1
P25_028	scratch_hardness_N: retry lightgbm on current features	scratch_hardness_N	2.1752	2.7731	-0.0988	0.35	REVERT	family=lightgbm feats=1
P25_029	scratch_hardness_N: retry extratrees on current features	scratch_hardness_N	2.0063	2.5952	0.0376	0.35	REVERT	family=extratrees feats=1
P25_030	gloss_60: retry lightgbm on current features	gloss_60	11.3918	15.1595	0.6386	0.35	REVERT	family=lightgbm feats=2
P25_031	gloss_60: retry extratrees on current features	gloss_60	10.2842	12.7117	0.7459	0.35	REVERT	family=extratrees feats=2
P25_032	gloss_60: retry ridge on current features	gloss_60	12.3708	14.7923	0.6559	0.35	REVERT	family=ridge feats=2
P25_033	hiding_power_pct: retry xgboost on current features	hiding_power_pct	2.8710	4.4107	0.5017	0.35	REVERT	family=xgboost feats=1
P25_034	hiding_power_pct: retry lightgbm on current features	hiding_power_pct	3.1177	4.7132	0.4311	0.35	REVERT	family=lightgbm feats=1
P25_035	hiding_power_pct: retry ridge on current features	hiding_power_pct	2.7461	4.1175	0.5658	0.35	REVERT	family=ridge feats=1
P25_036	cupping_mm: retry xgboost on current features	cupping_mm	1.7391	2.5522	0.6079	0.35	REVERT	family=xgboost feats=1
P25_037	cupping_mm: retry lightgbm on current features	cupping_mm	1.8441	2.5859	0.5975	0.35	REVERT	family=lightgbm feats=1
P25_038	cupping_mm: retry ridge on current features	cupping_mm	2.2192	2.8286	0.5184	0.35	REVERT	family=ridge feats=1
P25_039	gloss_60: xgb depth sweep d=4	gloss_60	10.2526	13.4255	0.7165	0.30	REVERT	family=xgboost feats=2
P25_040	gloss_60: xgb depth sweep d=5	gloss_60	9.9833	13.1928	0.7263	0.35	REVERT	family=xgboost feats=2
P25_041	gloss_60: xgb depth sweep d=6	gloss_60	10.0047	13.2310	0.7247	0.35	REVERT	family=xgboost feats=2
P25_042	gloss_60: xgb depth sweep d=8	gloss_60	9.9944	13.1933	0.7262	0.25	REVERT	family=xgboost feats=2
P25_043	gloss_60: xgb depth sweep d=10	gloss_60	10.0407	13.1937	0.7262	0.20	REVERT	family=xgboost feats=2
P25_044	hiding_power_pct: ExtraTrees max_features=sqrt	hiding_power_pct	2.2340	3.6933	0.6507	0.30	REVERT	family=extratrees feats=1
P25_045	hiding_power_pct: ExtraTrees max_features=log2	hiding_power_pct	2.2340	3.6933	0.6507	0.30	REVERT	family=extratrees feats=1
P25_046	hiding_power_pct: ExtraTrees max_features=0.5	hiding_power_pct	2.1866	3.6226	0.6639	0.30	KEEP	family=extratrees feats=1
P25_047	hiding_power_pct: ExtraTrees max_features=0.8	hiding_power_pct	2.2283	3.6407	0.6605	0.30	REVERT	family=extratrees feats=1
P25_048	hiding_power_pct: ExtraTrees max_features=1.0	hiding_power_pct	2.2635	3.6809	0.6530	0.30	REVERT	family=extratrees feats=1
P25_049	cupping_mm: ExtraTrees max_features=sqrt	cupping_mm	1.7357	2.3636	0.6637	0.30	REVERT	family=extratrees feats=1
P25_050	cupping_mm: ExtraTrees max_features=log2	cupping_mm	1.7357	2.3636	0.6637	0.30	REVERT	family=extratrees feats=1
P25_051	cupping_mm: ExtraTrees max_features=0.5	cupping_mm	1.5916	2.2401	0.6979	0.30	REVERT	family=extratrees feats=1
P25_052	cupping_mm: ExtraTrees max_features=0.8	cupping_mm	1.5376	2.1859	0.7124	0.30	REVERT	family=extratrees feats=1
P25_053	cupping_mm: ExtraTrees max_features=1.0	cupping_mm	1.5499	2.2182	0.7038	0.30	REVERT	family=extratrees feats=1
P25_054	scratch_hardness_N: Ridge alpha=0.01	scratch_hardness_N	1.8037	2.3479	0.2123	0.30	REVERT	family=ridge feats=1
P25_055	scratch_hardness_N: Ridge alpha=0.1	scratch_hardness_N	1.8033	2.3466	0.2132	0.40	REVERT	family=ridge feats=1
P25_056	scratch_hardness_N: Ridge alpha=0.5	scratch_hardness_N	1.8016	2.3411	0.2168	0.45	REVERT	family=ridge feats=1
P25_057	scratch_hardness_N: Ridge alpha=2.0	scratch_hardness_N	1.7952	2.3258	0.2270	0.35	REVERT	family=ridge feats=1
P25_058	scratch_hardness_N: Ridge alpha=5.0	scratch_hardness_N	1.7886	2.3085	0.2385	0.30	REVERT	family=ridge feats=1
P25_059	scratch_hardness_N: Ridge alpha=10.0	scratch_hardness_N	1.7822	2.2974	0.2458	0.25	REVERT	family=ridge feats=1
P25_060	scratch_hardness_N: kitchen sink 7 physics features	scratch_hardness_N	1.8221	2.3267	0.2265	0.30	REVERT	family=ridge feats=7
P25_061	gloss_60: kitchen sink 7 physics features	gloss_60	10.5173	13.5141	0.7128	0.30	REVERT	family=xgboost feats=7
P25_062	hiding_power_pct: kitchen sink 7 physics features	hiding_power_pct	2.3202	3.7467	0.6405	0.30	REVERT	family=extratrees feats=7
P25_063	cupping_mm: kitchen sink 7 physics features	cupping_mm	1.6775	2.3597	0.6648	0.30	REVERT	family=extratrees feats=7
GP_BASELINE	Published Zenodo GP baseline (RBF+DotProduct+WhiteKernel)	scratch_hardness_N	1.8440	2.4535	0.1434	1.00	BASELINE	family=gp published_ref
GP_BASELINE	Published Zenodo GP baseline (RBF+DotProduct+WhiteKernel)	gloss_60	11.4980	14.2840	0.6790	1.00	BASELINE	family=gp published_ref
GP_BASELINE	Published Zenodo GP baseline (RBF+DotProduct+WhiteKernel)	hiding_power_pct	2.8410	4.7810	0.4160	1.00	BASELINE	family=gp published_ref
GP_BASELINE	Published Zenodo GP baseline (RBF+DotProduct+WhiteKernel)	cupping_mm	2.1090	2.7530	0.5400	1.00	BASELINE	family=gp published_ref
